{
  "schema_version": 1,
  "change_id": "toy-impression-generator-1.0.0-to-1.1.0",
  "model_path": "model/toy_impression_generator.onnx",
  "from_version": "1.0.0",
  "to_version": "1.1.0",
  "behavior_classes": [
    "model_weights"
  ],
  "summary": "Adjust model weights while preserving the documented output contract.",
  "declared_by": "E.S.L SOFTWARE LAB LTD",
  "declared_at": "2026-09-22T00:00:00Z"
}
